image url,date taken,image size,account,description,date accessed
https://i.redd.it/qaetimk7lt801.jpg,2018-01-08 10:23:43,,ImagesOfNetwork,Frog or cane toad?,2021-04-07 08:58:50
https://i.redd.it/qaetimk7lt801.jpg,2018-01-08 10:22:42,,Lemon_Delicious,Frog or cane toad?,2021-04-07 08:58:50
https://imgur.com/snl9dfR.jpg,2017-12-27 15:22:52,,ImagesOfNetwork,Cane Toad Purse (a must-have souvenir from Australia),2021-04-07 08:58:51
https://imgur.com/snl9dfR.jpg,2017-12-27 15:20:40,,mysticalmisogynistic,Cane Toad Purse (a must-have souvenir from Australia),2021-04-07 08:58:51
https://i.redd.it/qb3mcq1zcb401.jpg,2017-12-16 16:46:46,,,"This is a comment section about a cane toad that died, we got the lifespan of the toad wrong and this dude went crazy",2021-04-07 08:58:52
https://i.redd.it/g6z3izgia9301.jpg,2017-12-11 08:48:04,,ImagesOfNetwork,Poisonous Hawaiian cane toad at the door wanting in.,2021-04-07 08:58:53
https://i.redd.it/g6z3izgia9301.jpg,2017-12-11 08:45:16,,,Poisonous Hawaiian cane toad at the door wanting in.,2021-04-07 08:58:53
https://i.redd.it/p9p2rhqrsz201.jpg,2017-12-10 00:49:47,,,Petting cane toad meme review soon pls,2021-04-07 08:58:54
http://www.amazingaustralia.com.au/cane_toad_races.htm,2017-11-26 16:36:37,,at132pm,"TIL that cane toad racing is an event where contestants kiss poisonous toads, bet on which toad will win the race, then often dispose of the toads by sticking them in freezers.",2021-04-07 08:58:59
http://www.amazingaustralia.com.au/cane_toad_races.htm,2017-11-26 16:33:37,,,"TIL about cane toad racing, an event where contestants kiss the poisonous toads, bet on which one will win the race, then often dispose of the toads afterwards by sticking them in freezers until they die.",2021-04-07 08:59:00
https://i.redd.it/ar8hkmnibtrz.jpg,2017-10-14 15:16:55,,OverlordSheepie,Ophelia my Cane Toad,2021-04-07 08:59:03
https://i.redd.it/8xqbebn3mbqz.jpg,2017-10-07 02:40:18,,OverlordSheepie,Lilith the Cane Toad,2021-04-07 08:59:05
https://i.redd.it/eim8s9r65jnz.jpg,2017-09-23 00:47:09,,,Cane/Marine Toad Setup!,2021-04-07 08:59:05
https://i.redd.it/2n5e7ymq84mz.jpg,2017-09-15 21:36:24,,ImagesOfNetwork,"Help please... I think this might be a cane toad. It's massive! (Tampa, FL)",2021-04-07 08:59:06
https://i.redd.it/2n5e7ymq84mz.jpg,2017-09-15 21:36:13,,msmisplaced,"Help please... I think this might be a cane toad. It's massive! (Tampa, FL)",2021-04-07 08:59:07
https://i.redd.it/35s5z3fslkhz.jpg,2017-08-23 23:41:09,,seethroughplate,"[Invasive Species] Cane Toad, Bufo marinus. In 1935 they were introduced into Australia to control destructive beetles in Queensland’s sugarcane crops. Cane toads are capable of poisoning predators that try to eat them and they continue to spread across Australia.",2021-04-07 08:59:10
http://i.imgur.com/t7xwBgX.jpg,2017-08-16 02:00:02,,ImagesOfNetwork,"PSA- If you have outdoor pets or children who garden with you, always be aware of cane toads. I buried my dog this morning :( She was my best friend and my gardening companion. It took less than 15 minutes from the time she bit the toad until she passed on.",2021-04-07 08:59:11
http://i.imgur.com/t7xwBgX.jpg,2017-08-16 01:59:59,,Pulelehua,"PSA- If you have outdoor pets or children who garden with you, always be aware of cane toads. I buried my dog this morning :( She was my best friend and my gardening companion. It took less than 15 minutes from the time she bit the toad until she passed on.",2021-04-07 08:59:12
https://i.redd.it/d1c11jvkk6dz.jpg,2017-08-01 19:49:00,,ImagesOfNetwork,The Cane Toad (bufo marinus) was introduced into Australia in 1935 to help control beetles that fed on the sugar cane crops. Their numbers have multiplied as they expand their habitat across the continent. They are quite toxic and native species that have used them for a good source are in decline.,2021-04-07 08:59:14
https://i.redd.it/d1c11jvkk6dz.jpg,2017-08-01 19:48:57,,ImagesOfNetwork,The Cane Toad (bufo marinus) was introduced into Australia in 1935 to help control beetles that fed on the sugar cane crops. Their numbers have multiplied as they expand their habitat across the continent. They are quite toxic and native species that have used them for a good source are in decline.,2021-04-07 08:59:14
https://i.redd.it/d1c11jvkk6dz.jpg,2017-08-01 19:48:51,,2BrkOnThru,The Cane Toad (bufo marinus) was introduced into Australia in 1935 to help control beetles that fed on the sugar cane crops. Their numbers have multiplied as they expand their habitat across the continent. They are quite toxic and native species that have used them for a good source are in decline.,2021-04-07 08:59:15
http://www.brisbanetimes.com.au/queensland/barry-white-mating-calls-could-sound-end-of-cane-toad-populations-study-finds-20170713-gxan8a.html,2017-07-15 07:29:36,,optimistic_agnostic,"'Barry White' mating calls could sound end of cane toad populations, study finds",2021-04-07 08:59:18
http://www.cerebuseffect.com/red/dct.jpg,2017-06-30 12:49:04,,ImagesOfNetwork,"Impaled Cane Toad in Naples, FL. Yes, that's a tennis ball and, yes, my mom needs photography lessons.",2021-04-07 08:59:19
http://www.cerebuseffect.com/red/dct.jpg,2017-06-30 12:48:59,,Kali_Drummer,"Impaled Cane Toad in Naples, FL. Yes, that's a tennis ball and, yes, my mom needs photography lessons.",2021-04-07 08:59:19
https://i.redd.it/egdra9n82e6z.jpg,2017-06-28 13:31:25,,Katemaree,A kneelback snek eating a cane toad.,2021-04-07 08:59:20
http://www.livescience.com/29560-cane-toad-conquest-invades-australia.html,2017-05-17 13:10:03,,,"TIL that after being released into Australia, the invasive Cane Toad single-handedly destroyed Australia's natural habitat in the northeast.",2021-04-07 08:59:23
https://i.redd.it/cmwgbujirfpy.jpg,2017-04-04 01:04:38,,threejeez,Are these Frogs Outside My House The Poisonous Bufo Marinus (aka Marine Toad aka Cane Toad aka Giant Toad)?,2021-04-07 08:59:24
https://i.redd.it/ofbpczjtibmy.jpg,2017-03-19 07:36:23,,ImagesOfNetwork,Not a cane toad for once!! (northern Australia),2021-04-07 08:59:25
https://i.redd.it/ofbpczjtibmy.jpg,2017-03-19 07:36:20,,stengineer,Not a cane toad for once!! (northern Australia),2021-04-07 08:59:26
http://www.smh.com.au/technology/sci-tech/nsw-government-to-fund-rick-shines-canetoad-sausage-strategy-to-help-save-native-wildlife-20170227-gumqro.html,2017-02-28 23:20:22,,AutoNewspaperAdmin,[Tech] - NSW government to fund Rick Shine's 'cane-toad sausage' strategy to help save native wildlife | Sydney Morning Herald,2021-04-07 08:59:28
http://www.smh.com.au/technology/sci-tech/nsw-government-to-fund-rick-shines-canetoad-sausage-strategy-to-help-save-native-wildlife-20170227-gumqro.html,2017-02-28 18:11:52,,AutoNewsAdmin,[Tech] - NSW government to fund Rick Shine's 'cane-toad sausage' strategy to help save native wildlife,2021-04-07 08:59:28
http://www.livetradingnews.com/yassmin-abdel-magied-cane-toad-australian-politics-31134.html#.WKsIyUOQ5lQ.reddit,2017-02-20 15:21:05,,LiveTrading,Yassmin Abdel-Magied the Cane Toad of Australian Politics,2021-04-07 08:59:29
https://i.redd.it/67j82bmb99by.png,2017-01-22 12:14:44,,,i think it's a rather urgent matter that needs to be answered. is he human or cane toad?,2021-04-07 08:59:33
https://i.redd.it/1dctg8wokszx.jpg,2016-11-25 16:23:47,,Ass_Masster,"Much like humans, the Bulgarian Cane Toad often gets cold ears in frigid climate's and since it lacks the thumbs to knit ear muffs they don soft shelled slugs to keep their ears nice and toasty",2021-04-07 08:59:38
http://www.canetoadsinoz.com/killingtoads.html,2016-11-09 05:36:27,,myloosechange,"TIL the most easiest and humane way to kill a Cane Toad in Australia is to pick it up with gloves, pop it into a plastic bag and place it in the fridge for a few hours to make it sleep. Once it is sleeping, move the bag with toad into the freezer for a few days to end it.",2021-04-07 08:59:44
http://funanimalfacts.livejournal.com/707.html,2016-07-07 10:41:19,,enjoyeverymomentinus,Amazing Cane Toad Facts You Should Know: funanimalfacts,2021-04-07 08:59:53
http://www.smh.com.au/queensland/cane-toad-toxin-used-to-lure-in-and-trap-tadpoles-20160613-gphsj7.html,2016-06-13 07:39:49,,m_i_t_t,Cane toad toxin used to lure in and trap tadpoles,2021-04-07 08:59:55
http://i.imgur.com/wEulR9E.jpg,2016-06-03 05:37:13,,jinglingii,"A baby northern quoll, a native Australian mammal battling for survival against introduced species. Scientists are training quolls to be ‘toad smart'and avoid eating poisonous cane toads, before releasing them back into",2021-04-07 08:59:57
http://www.brisbanetimes.com.au/queensland/whack-or-chill-cane-toad-haters-opt-for-the-irons-20110219-1b039.html,2016-04-30 23:05:14,,Hackiisan,"TIL that ""Cane toad golfing"", i.e. practicing golf swings with cane toads as the ball, is a thing in some parts of Australia",2021-04-07 08:59:59
http://journals.plos.org/plosone/article?id=10.1371%2Fjournal.pone.0152492,2016-04-13 18:05:55,,officialcitral,Patterns of Genetic Variability in Island Populations of the Cane Toad (Rhinella marina) from the Mouth of the Amazon,2021-04-07 09:00:01
http://toadshop.com/purses-wallets/22-four-leg-cane-toad-shoulder-purse.html,2015-11-05 05:50:25,,Mpath420,Was looking up cane toad and found this great gift idea for Maude.,2021-04-07 09:00:10
http://i.imgur.com/krw8wBD.jpg,2015-11-05 02:43:15,,,Michael Cane Toad,2021-04-07 09:00:11
http://i.imgur.com/Pfpsvbm.jpg,2015-10-03 20:05:11,,,"Invasive species names could all be used Wu Tang song ""Killer Bee"", ""Cane Toad"", ""Mute Swan"", ""Crazy Ant""",2021-04-07 09:00:12
http://i.imgur.com/kBUqI4u.jpg,2015-07-19 13:24:17,,,"Double denims, oversized trainers, cane toad races...",2021-04-07 09:00:15
http://i.imgur.com/F4PTDGu.jpg,2015-06-03 18:54:01,,,"I have a crow that comes to my house, it eats cane toads knocks over my plastic scare owl, then does things like this- aka gets smashed on toad poison fights my plastic owl then hits the nurofen plus for his head ache",2021-04-07 09:00:18
http://i.imgur.com/cnVZKh0.gifv,2015-04-20 02:19:45,,,"Everton Hills, Queensland AUS Found by a river teeming with cane toads, and this guy was mimicking them, jumping around exactly like them. It was the size of a baby cane toad too.",2021-04-07 09:00:24
http://www.independent.co.uk/environment/nature/at-long-last-australia-is-able-to-halt-the-relentless-advance-of-the-cane-toad-10061911.html,2015-02-28 20:46:27,,Khalexus,"At long last, Australia is able to halt the relentless advance of the cane toad",2021-04-07 09:00:31
http://i.imgur.com/G4Bvoca.jpg,2015-02-17 04:26:00,,,"Is this a cane toad? My cousin moved out to Hawaii, as her husband is in the military. I cropped out everyone's faces. Thanks!",2021-04-07 09:00:33
http://i.imgur.com/aFauWfY.jpg,2015-02-12 02:57:23,,Castigated,Not sure if ugly or cute? A baby cane toad!,2021-04-07 09:00:35
http://i.imgur.com/lwQxbSt.jpg,2015-02-04 11:17:44,,rjchau,Spiderbro huntsman vs a cane toad - a horrifically invasive pest in the northern half of Australia,2021-04-07 09:00:37
http://i.imgur.com/lwQxbSt.jpg,2015-02-04 08:18:59,,,"[Brisbane, Australia] Spider vs. Cane Toad",2021-04-07 09:00:37
http://i.imgur.com/eayAOIO.jpg,2015-02-04 03:12:41,,,Spider vs Cane Toad,2021-04-07 09:00:39
http://images.nationalgeographic.com/wpf/media-live/photos/000/004/cache/cane-toad_488_600x450.jpg,2015-01-11 17:30:07,,Alantha,"[HAFF] Native to the Americas, the venomous cane toad was brought to Queensland, Australia, in the 1930s in an unsuccessful attempt to reduce destructive beetle populations.",2021-04-07 09:00:40
http://images.nationalgeographic.com/wpf/media-live/photos/000/004/cache/cane-toad_488_600x450.jpg,2015-01-11 17:28:11,,,"Native to the Americas, the venomous cane toad was brought to Queensland, Australia, in the 1930s in an unsuccessful attempt to reduce destructive beetle populations.",2021-04-07 09:00:41
http://i.imgur.com/c10htZP.jpg,2014-12-16 14:14:13,,uvronac,Cane Toad Hunting Australia,2021-04-07 09:00:43
http://i.imgur.com/1HHUvpD.jpg,2014-12-05 02:06:13,,,"If you are cis, you need to eat a cane toad",2021-04-07 09:00:43
http://i.imgur.com/QGGEBg6.jpg,2014-10-28 23:58:31,,wsgy111,Watching a documentary on the Cane Toad problem in Queensland. You guys seen any docs worthwhile that aren't about making sushi?,2021-04-07 09:00:45
http://i.imgur.com/TlcPUr9.jpg,2014-08-16 06:34:10,,kelamoku62,Best scene from cane toad documentary,2021-04-07 09:00:50
http://i.imgur.com/NRVNjlk.jpg,2014-08-14 23:48:27,,,"After visiting Australia I have found the reason for their lack of posts, Cane Toad Racing!",2021-04-07 09:00:50
http://i.imgur.com/IPjpdWm.jpg,2014-06-15 19:21:02,,DonTago,"The Dreaded 'Cane Toad', Scourge of Australia. About 100 were released in Australia in 1935, in an attempt to control cane beetles attacking sugar cane crops; but now those hundred have exploded into approximated 1.5 billion toads.",2021-04-07 09:00:53
http://i.imgur.com/Lowpsez.jpg,2014-06-15 19:19:08,,,"A Small Change Purse, Made of Taxidermied Cane Toad",2021-04-07 09:00:53
http://feeds.theguardian.com/c/34708/f/663879/s/3b2475f1/sc/4/l/0L0Stheguardian0N0Cworld0C20A140Cjun0C0A40Ccane0Etoad0Elike0Especies0Ediscovered0Emelbourne/story01.htm,2014-06-04 06:51:58,,rssr,Alarm raised after cane toad-like species discovered in Melbourne,2021-04-07 09:00:55
https://www.youtube.com/watch?v=f6kKYO9AU4k&feature=youtu.be,2014-05-28 13:22:20,,,Pet dog trips out on cane toad poison,2021-04-07 09:00:57
http://i.imgur.com/aLG1G0v.jpg,2014-04-25 22:06:18,,,Eye of a Cane Toad,2021-04-07 09:01:01
http://i.imgur.com/vwkkal7.jpg,2014-04-25 12:15:59,,nbpx,Fijian Cane Toad [OC] (2448 x 1836],2021-04-07 09:01:01
http://www.csiro.au/proprietaryDocuments/CSE_ctfacts.pdf,2014-04-22 08:52:10,,TheBlazingPhoenix,"Cane Toad, The Introduction Gone Wrong",2021-04-07 09:01:01
http://i.imgur.com/qw4PRka.jpg,2014-04-04 12:58:51,,BitchJustTakeIt,Chillin on a fake cane toad.,2021-04-07 09:01:02
http://i.imgur.com/e2j9KW8.jpg,2014-03-29 13:54:22,,ZakDougall,The biggest damn Cane Toad I've ever seen/caught.,2021-04-07 09:01:03
http://i.imgur.com/4rK6oGS.jpg,2014-03-17 16:03:42,,certifiedsoul,A picture of my Cane toad Smaug!,2021-04-07 09:01:07
http://i.imgur.com/xL25q2P.jpg,2014-03-10 06:52:24,,Verily44,Grumpy Cane Toad,2021-04-07 09:01:08
http://www.boomerangshack.com/images2/toad.jpg,2014-02-27 21:44:34,,penciljockey123,Coin purse made from a cane toad,2021-04-07 09:01:08
http://i.imgur.com/J8LkphJ.jpg,2014-02-02 13:48:19,,NoPepsiIsNotOkay,"Yes, it's that time of year when the driveway/easement is lit up with the glowing eyes of a welcoming party of toads. What's your approach? Live and let live? Cane toad golf?",2021-04-07 09:01:10
http://i.imgur.com/XtdRewt.png,2014-01-16 11:33:42,,pistola,Cane toad golfing... serious business,2021-04-07 09:01:11
http://toadshop.com/accessories/24-cane-toad-bow-tie.html,2013-12-31 03:19:49,,trainbike1,awesome cane toad bowtie,2021-04-07 09:01:12
http://i.imgur.com/DoUjJ7j.jpg,2013-12-26 15:22:29,,,Cane toad warning sign (x-post from /r/Australia).,2021-04-07 09:01:13
http://i.imgur.com/DoUjJ7j.jpg,2013-12-25 22:20:43,,pants_on_my_head,"So my friend found a cane toad in her pond again, decided to send them a message. (Probably NSFW)",2021-04-07 09:01:14
http://science.howstuffworks.com/zoology/reptiles-amphibians/hallucinogenic-frog1.htm,2013-11-23 03:39:26,,backgroundN015e,"TIL: In the 1980s, the Australian government outlawed the consumption of cane toad excretions under the Drug Misuse Act.",2021-04-07 09:01:15
http://i.imgur.com/5wbrXHy.jpg,2013-11-10 17:11:06,,,Cane toad eating a bat (x-post r/WTF),2021-04-07 09:01:16
http://i.imgur.com/uq9m4jh5.jpg,2013-11-10 08:24:58,,,Freaky X-Ray of a cane toad eating an abandoned baby,2021-04-07 09:01:16
http://i.imgur.com/5wbrXHy.jpg,2013-11-09 21:39:22,,xenomorphs_sombrero,Cane toad eating a bat,2021-04-07 09:01:17
http://i.imgur.com/ie3VaxJ.jpg,2013-09-25 20:26:08,,,Cane toad eating a bat in Peru.,2021-04-07 09:01:20
http://cdn.grindtv.com/wp-content/uploads/2013/09/cane-toad.jpg,2013-09-24 03:41:34,,IceIceIceReddit,Cane toad trying to eat a bat,2021-04-07 09:01:21
http://cdn.grindtv.com/wp-content/uploads/2013/09/cane-toad.jpg,2013-09-23 20:28:48,,gmfreak1991,Cane toad eats bat. Nom nom,2021-04-07 09:01:22
http://www.grindtv.com/outdoor/nature/post/alien-like-creature-actually-a-toad-with-a-big-appetite/#.UkCVNMT4EIY.facebook,2013-09-23 19:36:37,,,A cane toad swallowed a bat.,2021-04-07 09:01:22
http://i.imgur.com/hs1EsLq.jpg,2013-09-21 14:27:40,,,Australian cane toad,2021-04-07 09:01:23
http://i.imgur.com/jwJaPAY.jpg,2013-08-02 22:50:25,,WhatTheFoxtrout,Please tell me this is NOT a Cane Toad (bufo marinus)!!!,2021-04-07 09:01:25
http://i.imgur.com/pphEQ.jpg,2013-07-25 16:58:57,,JonLuca,Cane toad eggs,2021-04-07 09:01:25
http://www.jokeroo.com/pictures/funny/the-biggest-frog-in-the-world.html,2013-03-28 17:26:37,,TruStory2426,That cane toad was big as shit....I'm not sure what to make of this monster,2021-04-07 09:01:29
http://4.bp.blogspot.com/-U_5mzz150rQ/TfAQQLwP9cI/AAAAAAAAAj4/A5wRR74zXfE/s1600/CANE-TOAD.jpg,2013-03-27 16:29:54,,,I see your Cane toad and raise you a Cane toad with tits,2021-04-07 09:01:29
http://i.imgur.com/2f8oYDH.jpg,2013-03-27 13:40:53,,,I see your cane toad and raise you a goliath toad. (sorry for poor quality) ,2021-04-07 09:01:29
http://i.imgur.com/ucg1Xjv.jpg,2013-02-11 05:31:22,,superstoreman,"Mutated cane toad found in Queensland, Australia. ",2021-04-07 09:01:31
http://i.imgur.com/TZhEmxs.jpg,2013-02-07 05:08:11,,urno,Cane toad screen door soon,2021-04-07 09:01:31
http://www.strayacunt.com.au/wp-content/gallery/straya-pictures/canetoad_ride_kid_original_straya_day_comp.jpg,2013-02-03 13:25:55,,STRAYACUNTcomau,Straya Kid ridin' cane toad,2021-04-07 09:01:32
http://i.imgur.com/UZgxo.jpg,2013-01-19 22:32:40,,jehmaster,"TOAD IDENTIFICATION PLEASE BOUGHT IT AS A CANE TOAD BUT I DONT THINK IT IS, I HOPE THIS PICTURE OPENS",2021-04-07 09:01:32
