image url,date taken,image size,account,description,date accessed
https://preview.redd.it/hoox0p34qfg41.png?width=716&format=png&auto=webp&s=040552fc83f8499a2afba77fad124dbc06684b1e,2020-02-12 06:06:19,"[600, 716]",HaoXLee,[Arknights lore] Abyssal Hunters and Cute little frog - Blue Poison,2021-04-07 08:55:40
https://preview.redd.it/4h40ekqqpfg41.png?width=1080&format=png&auto=webp&s=06dc3ef17e6df004585084b1a32f41a6be526703,2020-02-12 06:06:19,"[770, 1080]",HaoXLee,[Arknights lore] Abyssal Hunters and Cute little frog - Blue Poison,2021-04-07 08:55:40
https://preview.redd.it/twevfhnfjeg41.png?width=640&format=png&auto=webp&s=46b48b71bb33c38ff4b6d46e4e5d0e7c69dc9ec9,2020-02-12 06:06:19,"[667, 640]",HaoXLee,[Arknights lore] Abyssal Hunters and Cute little frog - Blue Poison,2021-04-07 08:55:40
https://preview.redd.it/ap0717ydkeg41.png?width=282&format=png&auto=webp&s=bc080770ca67be92fa3ac2460e7ed797e8957fbf,2020-02-12 06:06:19,"[124, 282]",HaoXLee,[Arknights lore] Abyssal Hunters and Cute little frog - Blue Poison,2021-04-07 08:55:40
https://preview.redd.it/kqpfcfr4keg41.png?width=347&format=png&auto=webp&s=2f70a10620b1047b9d3dcfbb8ee3cfd158dea83a,2020-02-12 06:06:19,"[278, 347]",HaoXLee,[Arknights lore] Abyssal Hunters and Cute little frog - Blue Poison,2021-04-07 08:55:40
https://preview.redd.it/2g1qjrg2keg41.png?width=1024&format=png&auto=webp&s=7e95bc2559872a4d881bca5fdcd8e49f71c6dd4a,2020-02-12 06:06:19,"[1024, 1024]",HaoXLee,[Arknights lore] Abyssal Hunters and Cute little frog - Blue Poison,2021-04-07 08:55:40
https://preview.redd.it/2vef9322leg41.png?width=660&format=png&auto=webp&s=f8f29c5f6bf9442c5e1df989f710aa6bfa89d4f3,2020-02-12 06:06:19,"[516, 660]",HaoXLee,[Arknights lore] Abyssal Hunters and Cute little frog - Blue Poison,2021-04-07 08:55:40
https://preview.redd.it/lyghs6dqleg41.png?width=436&format=png&auto=webp&s=d1f68e19dac83a976d8da334a4c61128d74ab4a1,2020-02-12 06:06:19,"[377, 436]",HaoXLee,[Arknights lore] Abyssal Hunters and Cute little frog - Blue Poison,2021-04-07 08:55:40
https://preview.redd.it/r6hrtyqhnfg41.png?width=181&format=png&auto=webp&s=65daee0a852ba17b90457a44a6a240b03511a5ef,2020-02-12 06:06:19,"[174, 181]",HaoXLee,[Arknights lore] Abyssal Hunters and Cute little frog - Blue Poison,2021-04-07 08:55:40
https://i.redd.it/qp8yaub1l5f41.jpg,2020-02-05 19:02:05,,,Australian water rat cuts cane toad open to eat their heart and livers while avoiding poisonous skin and glands [x-post from Australia],2021-04-07 08:55:41
https://i.redd.it/vb3yz7k7awe41.jpg,2020-02-04 11:45:21,,,Cane Toad anyone? From smoke free home...,2021-04-07 08:55:42
https://i.redd.it/i1hubuwf7we41.jpg,2020-02-04 11:29:51,,frontdesklife1645,Cane Toad anyone? From smoke free home...,2021-04-07 08:55:42
https://i.redd.it/jag1bzxd7we41.jpg,2020-02-04 11:29:34,,,Cane Toad anyone? From smoke free home...,2021-04-07 08:55:43
https://i.redd.it/pjsw9pi6vmd41.jpg,2020-01-29 03:00:58,,VegemiteAndMiloToast,"Cane toad or frog? North Queensland, back yard",2021-04-07 08:55:43
https://i.redd.it/h1th222jzqb41.png,2020-01-19 14:45:07,,,Solid Florida chunk on the Gambler Cane Toad while hunting for Snakeheads.,2021-04-07 08:55:46
https://i.redd.it/tjwvyv46i9b41.jpg,2020-01-17 03:57:09,,SeasonedStarfish,"My cane toad (Pattie) stays in her water bowl all day, should I be concerned?",2021-04-07 08:55:47
https://i.redd.it/rpmkpya9mza41.jpg,2020-01-15 18:41:43,,,This little guy nearly died today after licking a cane toad he was foaming from the mouth and vomiting everywhere but we washed all the poison out of his mouth and my mum took him to the vet and they said he was fine I cried the whole time thinking this was it but he's all goods now say hi to Bowie.,2021-04-07 08:55:47
https://i.redd.it/8udoumso4ma41.jpg,2020-01-13 21:22:06,,MICHE621,Cane Toad Coin Purse to Match Your Bow Tie!,2021-04-07 08:55:48
https://i.redd.it/zs4xzgyvkia41.jpg,2020-01-13 09:25:24,,zzliberated,Not sure but i think is a cane toad.,2021-04-07 08:55:48
https://i.redd.it/jwmjn70ixfa41.jpg,2020-01-13 00:29:02,,courtesy_flush_plz,"this cane toad, named Sir LunchBox",2021-04-07 08:55:49
https://i.redd.it/hbx2q1zi0h641.jpg,2019-12-23 23:51:19,,dalburgh,Can someone ID? Twas sold to me as a Cane toad I just wanted to get some second opinions on the species.,2021-04-07 08:55:52
https://i.redd.it/rx2nidv9e1641.jpg,2019-12-21 19:19:51,,aarogar,Cane Toad Bow Tie,2021-04-07 08:55:52
https://i.redd.it/50mvt3r62b341.jpg,2019-12-08 00:37:28,,Glumbert69,"I would like to remind everyone of slippy, pewds toad (cane toad I think)that was the cutest thing ever and I want this as a memorial and last kind of appreciation post for him in this decade as it’s coming to an end.",2021-04-07 08:55:54
https://i.redd.it/pbwexuwlta241.jpg,2019-12-02 22:48:02,,,Here's a Cane Toad,2021-04-07 08:55:54
https://i.redd.it/pbwexuwlta241.jpg,2019-12-02 22:45:16,,,Here's a Cane Toad,2021-04-07 08:55:55
https://i.redd.it/gkiymn33y4241.jpg,2019-12-02 02:59:40,,Blb9191,This Cane toad.,2021-04-07 08:55:55
https://i.redd.it/3ckytzqao4241.jpg,2019-12-02 02:05:04,,Oculus_Orbus,All Glory to the Cane Toad!!!,2021-04-07 08:55:56
https://i.redd.it/1kqs7rlov2141.png,2019-11-26 18:58:39,,Haasio,10 of clubs: the cane toad,2021-04-07 08:55:56
https://i.redd.it/cz5qojiz7s041.jpg,2019-11-25 07:07:51,,,"This cane toad is not native to Florida, but rather South/Central America.",2021-04-07 08:55:57
https://i.redd.it/zv9mez1d4j041.jpg,2019-11-24 00:32:58,,d-ray80,"Cane toad? I have a few dogs in south Florida and typically kill big toads like this bagel sized fella when found in my yard assuming them to be invasive and toxic. Just want y’alls opinion, don’t wanna kill anything that’s not harmful to my family or dogs.",2021-04-07 08:55:57
https://i.imgur.com/EGdol7M.jpg,2019-11-21 07:53:30,,WideBrownLand,I was lucky enough to see a Keelback snake eating a cane toad. These snakes can eat small cane toads without feeling the effects of the toxins. I watched this one eat 3 toads in five minutes.,2021-04-07 08:56:01
https://preview.redd.it/7s60glitttz31.jpg?width=733&format=pjpg&auto=webp&s=4672234ddac4cc1f0142a8bffec1a4463ddeefb1,2019-11-20 11:28:02,"[550, 733]",thetopfactsite,30 Fun facts about Crows that’ll have you cawing for more!,2021-04-07 08:56:01
https://i.redd.it/niej5qd9zdz31.jpg,2019-11-18 06:09:53,,ThatRandomShop,My puppy coming back from the vets after eating a cane toad,2021-04-07 08:56:01
https://i.redd.it/16dzxvm25ow31.png,2019-11-04 13:07:55,,,🔥 A cane toad eating a bat 🔥,2021-04-07 08:56:03
https://i.redd.it/a9ecswlb0ow31.png,2019-11-04 12:41:20,,,A cane toad eating a bat,2021-04-07 08:56:04
https://i.redd.it/ihp4im75bku31.jpg,2019-10-24 22:06:43,,zimone94,Cane toad?,2021-04-07 08:56:05
https://i.redd.it/0l2oq9gipxr31.jpg,2019-10-11 15:57:52,,zimone94,Cane or Florida toad?,2021-04-07 08:56:07
https://i.imgur.com/espYOzM.jpg,2019-10-10 18:29:45,,rekced,Just found in yard: Bufo/cane toad?,2021-04-07 08:56:07
https://i.imgur.com/dDZThGa.jpg,2019-10-07 17:33:22,,throughmethroughyou,The Flying Cane Toad,2021-04-07 08:56:08
https://i.redd.it/st4hd159mup31.jpg,2019-10-01 03:25:55,,,Cane Toad,2021-04-07 08:56:09
https://i.redd.it/wcx061pbztp31.jpg,2019-10-01 01:17:24,,GrAaSaBa,Cane Toad,2021-04-07 08:56:09
https://i.redd.it/hqwp8a536ip31.jpg,2019-09-29 09:33:58,,jamescridland,Evil bastard cane toad,2021-04-07 08:56:10
https://i.redd.it/knc7ama3s1p31.jpg,2019-09-27 02:26:58,,,Cane toad. Their skin contains deadly toxins that can kill many animals. Dogs are particularly vulnerable.,2021-04-07 08:56:10
https://i.redd.it/lbvlqf8krdo31.jpg,2019-09-23 17:41:15,,,This Cane Toad,2021-04-07 08:56:11
https://i.redd.it/yn65efa7a2o31.jpg,2019-09-22 03:04:25,,tyrone2538,ID needed! Near Charlotte NC. A cane toad or just a southern toad?,2021-04-07 08:56:11
https://i.redd.it/h1cchhq8ldn31.jpg,2019-09-18 16:01:46,,SultanOfSchwing,Cane toad,2021-04-07 08:56:12
https://i.redd.it/9hriex6kium31.jpg,2019-09-15 23:52:52,,,I hope you enjoy this cane toad,2021-04-07 08:56:13
https://i.redd.it/jdrf3wmebml31.jpg,2019-09-09 19:14:20,,reptopolis,Cane Toad Staring into the Void.,2021-04-07 08:56:15
https://i.redd.it/7kxooeb9bml31.jpg,2019-09-09 19:13:31,,reptopolis,Cane Toad Contemplating Life.,2021-04-07 08:56:15
https://i.redd.it/swk0mfu62ti31.jpg,2019-08-26 14:42:46,,mirandawest966,This is Mr. Grumpy my new cane toad! I can't wait to feed him lots of bugs so he can get super big!,2021-04-07 08:56:20
https://i.redd.it/n3o5yrpsydh31.jpg,2019-08-19 10:52:53,,litl_bear,"Hey guys, any help IDing this toad? Seen Cornwall, UK. Someone suggests Cane Toad?",2021-04-07 08:56:21
https://i.redd.it/h9mh05o206h31.png,2019-08-18 08:06:03,,Xzilinov,Cane Toad Time,2021-04-07 08:56:21
https://i.redd.it/0lld5yjncae31.jpg,2019-08-03 19:31:02,,,"please id this frog? i suspect it’s a cane toad, but unsure. frog was handled as safely as possible. (philippines)",2021-04-07 08:56:24
https://i.imgur.com/lLSQ7Ek.jpg,2019-07-31 04:35:28,,shh_im_studying,"Found this big guy in my backyard (FL), but can’t tell if cane toad",2021-04-07 08:56:24
https://i.redd.it/lchli12yk2d31.jpg,2019-07-28 16:19:16,,flynn0720,Wild cane toad,2021-04-07 08:56:25
https://i.redd.it/4u8s7eakduc31.jpg,2019-07-27 12:44:16,,advantone,"Is this a cane toad? He's pretty chill and small. If he's a frog, I'm releasing him back.",2021-04-07 08:56:25
https://www.sciencedaily.com/releases/2019/07/190723190847.htm,2019-07-25 16:31:42,,AutoNewspaperAdmin,[Offbeat] - Cane toad testes smaller at the invasion front | ScienceDaily,2021-04-07 08:56:26
https://www.sciencedaily.com/releases/2019/07/190723190847.htm,2019-07-25 16:08:10,,AutoNewsAdmin,[Offbeat] - Cane toad testes smaller at the invasion front,2021-04-07 08:56:26
https://i.redd.it/pjk11pssabc31.jpg,2019-07-24 20:34:14,,Technoten,Cane toad friends,2021-04-07 08:56:27
https://i.redd.it/yjjz79gfj3b31.jpg,2019-07-18 17:28:01,,,"What is the toad? It looks like a young cane toad but not sure. Found in Delhi, NY",2021-04-07 08:56:30
https://i.redd.it/pk8vsdn75y931.jpg,2019-07-12 22:11:26,,,Cane toad c:,2021-04-07 08:56:36
https://i.redd.it/kb2rvwserp931.jpg,2019-07-12 10:31:41,,,"PsBattle: This ""Slightly larger than normal cane toad"" toad",2021-04-07 08:56:36
https://i.redd.it/kb2rvwserp931.jpg,2019-07-12 10:22:59,,,"PsBattle: This ""Slightly larger than normal cane toad"" toad",2021-04-07 08:56:36
https://i.redd.it/kb2rvwserp931.jpg,2019-07-12 10:21:44,,,"This ""Slightly larger than normal cane toad"" toad",2021-04-07 08:56:37
https://i.redd.it/kb2rvwserp931.jpg,2019-07-12 06:59:50,,3slyfox,PsBattle: This massive cane toad,2021-04-07 08:56:37
https://i.redd.it/kb2rvwserp931.jpg,2019-07-12 05:38:19,,harindaka,Slightly larger than normal cane toad.,2021-04-07 08:56:38
https://i.redd.it/kb2rvwserp931.jpg,2019-07-12 03:23:14,,beowulfwallace,Slightly larger than normal cane toad.,2021-04-07 08:56:38
https://i.redd.it/kb2rvwserp931.jpg,2019-07-12 02:25:15,,leahsmomma1031,Slightly larger than normal cane toad.,2021-04-07 08:56:38
https://i.redd.it/kb2rvwserp931.jpg,2019-07-12 02:15:54,,shanks_o_ruivo,Slightly larger than normal cane toad.,2021-04-07 08:56:39
https://i.redd.it/kb2rvwserp931.jpg,2019-07-12 00:48:11,,,Slightly larger than normal cane toad.,2021-04-07 08:56:39
https://i.redd.it/kb2rvwserp931.jpg,2019-07-11 21:12:04,,,"Nightmarish, enormous cane toad",2021-04-07 08:56:40
https://i.redd.it/vzybkwq3nq931.jpg,2019-07-11 20:57:25,,noderp44,PSBattle: This Large Cane Toad,2021-04-07 08:56:40
https://i.redd.it/kb2rvwserp931.jpg,2019-07-11 20:47:03,,XxSabirahxX,Slightly larger than normal cane toad.,2021-04-07 08:56:40
https://i.redd.it/kb2rvwserp931.jpg,2019-07-11 17:59:53,,,Slightly larger than normal cane toad.,2021-04-07 08:56:41
https://i.redd.it/jmccrll3b0631.jpg,2019-06-23 01:11:28,,CrazysaurusRex,"Found this guy in the backyard, is he a Cane toad?",2021-04-07 08:56:46
https://i.redd.it/kskk7yagut431.png,2019-06-17 02:23:17,,wildgio,I believe this is a Cane Toad I found. While walking my dog.,2021-04-07 08:56:46
https://i.redd.it/wl86veze3g431.jpg,2019-06-15 04:08:34,,certified-twink,"Central American cane toad -has poison in its cheeks so that when a predator bites down on it, the puss-like substance will flow out causing the predator to be poisoned as a natural defensive mechanism. Also the cane toads are just so cuteee! (And are great pets!)",2021-04-07 08:56:46
https://i.redd.it/6lxg1tuu33231.jpg,2019-06-03 06:19:47,,,Cane or southern toad? Or both??,2021-04-07 08:56:52
https://i.redd.it/6v40orqzykz21.jpg,2019-05-21 15:12:01,,,Can anyone identify this toad found in central Florida? Cane toad? It was about 4-5 inches long,2021-04-07 08:56:52
https://i.redd.it/ss499031arw21.png,2019-05-07 09:13:34,,sxqe,cane toad poison,2021-04-07 08:56:55
https://i.redd.it/6khcgjqpyvu21.jpg,2019-04-27 22:49:23,,beandip111,Is this a cane toad? Found in South Florida eating with the cats.,2021-04-07 08:56:57
https://i.redd.it/awboftfmiko21.jpg,2019-03-27 01:55:05,,The_Almighty_Ian,Found this little one on my front porch. Is it a cane toad?,2021-04-07 08:57:03
https://i.redd.it/bg599y9ssio21.jpg,2019-03-26 20:08:12,,Flyhigh15,Cane Toad Leather Bow Tie,2021-04-07 08:57:03
https://i.redd.it/avfmoe65gvn21.jpg,2019-03-23 13:36:26,,,Cane toad with human shadow,2021-04-07 08:57:04
https://i.redd.it/e3kyvkz7udn21.jpg,2019-03-21 02:23:12,,TedTheHappyGardener,This map showing the range of the Cane toad in Florida.,2021-04-07 08:57:04
https://www.brisbanetimes.com.au/entertainment/let-them-eat-cane-toad-mona-cookbook-puts-the-problem-on-the-plate-20190311-h1c8h2.html,2019-03-19 13:44:03,,fatcity,"Let them eat cane toad, cookbook puts the problem on the plate",2021-04-07 08:57:04
https://preview.redd.it/8plnse54ytm21.jpg?width=2976&format=pjpg&auto=webp&s=72a0a976b5ee58894f935fa1206b6601a07d6549,2019-03-18 07:31:06,"[3968, 2976]",virtualworldoverload,I have this one edgy teacher!,2021-04-07 08:57:05
https://preview.redd.it/44npo884ytm21.jpg?width=3968&format=pjpg&auto=webp&s=fd45eb07a269fdb9a19c6d9e88d8a22a89e37e2d,2019-03-18 07:31:06,"[2976, 3968]",virtualworldoverload,I have this one edgy teacher!,2021-04-07 08:57:05
https://preview.redd.it/rwzgwg54ytm21.jpg?width=2976&format=pjpg&auto=webp&s=80d0bf7100219b2e62bd8abaadfd5f75dc84e6c1,2019-03-18 07:31:06,"[3968, 2976]",virtualworldoverload,I have this one edgy teacher!,2021-04-07 08:57:05
https://i.redd.it/nt6h7kqkelm21.jpg,2019-03-17 02:46:14,,,"🔥 Cane toads, the largest toad species, can reach 9.4 inches when fully grown 🔥",2021-04-07 08:57:06
https://i.redd.it/dnzya4ga2el21.jpg,2019-03-11 01:00:15,,,🔥 Costa Rican Cane Toad,2021-04-07 08:57:07
https://i.redd.it/yg8oij532el21.jpg,2019-03-11 00:59:10,,,Costa Rican Cane Toad,2021-04-07 08:57:08
https://i.imgur.com/d1t0kKP.jpg,2019-02-26 09:36:37,,petpkcui,I see your wedge-tailed eagle eating a rat and raise you a cane toad eating a bat,2021-04-07 08:57:10
https://i.redd.it/71s9fswouli21.jpg,2019-02-24 23:59:28,,,cane toad vivarium time,2021-04-07 08:57:11
https://i.redd.it/q4eozpbbkoh21.jpg,2019-02-20 08:02:27,,,Virgin Snake vs. Chad Cane Toad,2021-04-07 08:57:12
https://i.redd.it/4rgbkrj6sff21.jpg,2019-02-09 00:22:17,,ErendJames,Cane Toad on Stand with Rum Bottle,2021-04-07 08:57:13
https://i.imgur.com/hL8GFqo.jpg,2019-02-08 13:26:34,,Lechku,I see your wedge-tailed eagle eating a rat and raise you a cane toad eating a bat,2021-04-07 08:57:14
https://i.redd.it/zg4gepg8uoe21.jpg,2019-02-05 05:45:40,,taeminjpg,Cane toad coin purses,2021-04-07 08:57:14
https://i.etsystatic.com/16357524/r/il/0e8cfa/1431130172/il_570xN.1431130172_gqyi.jpg,2019-01-30 17:46:10,,,"This real cane toad purse, sphincter and all.",2021-04-07 08:57:15
https://i.redd.it/86vxcplbpwc21.jpg,2019-01-27 06:04:07,,Kyal_B05,Hello fellow Australians if u want to kill a cane toad remember slippy R.I.P,2021-04-07 08:57:16
https://i.redd.it/4ccb441sv2a21.jpg,2019-01-12 23:38:43,,harrylapage,Got myself a young CB Suriname cane toad the other day.,2021-04-07 08:57:18
https://i.redd.it/8av1vu4zzo921.jpg,2019-01-11 00:57:11,,,"Baby cane toad (Rhinella marina) in North Queensland, Australia",2021-04-07 08:57:19
https://i.redd.it/4g3x7c3yzo921.jpg,2019-01-11 00:57:01,,,"Baby cane toad (Rhinella marina) in North Queensland, Australia",2021-04-07 08:57:19
https://i.redd.it/mi62qtiwzo921.jpg,2019-01-11 00:56:48,,j0eboy83,"Baby cane toad (Rhinella marina) in North Queensland, Australia",2021-04-07 08:57:19
https://i.redd.it/berk1925zi921.jpg,2019-01-10 04:41:47,,,This Lucky Cane Toad is an Absolute Unit,2021-04-07 08:57:20
https://i.redd.it/8cb2286989921.jpg,2019-01-08 19:55:05,,,Python versus Cane Toad. In Australia.,2021-04-07 08:57:23
https://i.redd.it/ebg2e7avj2921.jpg,2019-01-07 21:27:42,,DSlamAU,🔥 Cane toad kills snake trying to kill cane toad is peak Australia,2021-04-07 08:57:24
https://i.redd.it/k4qwkc5bj2921.jpg,2019-01-07 21:24:35,,DSlamAU,Cane toad kills snake trying to kill it,2021-04-07 08:57:24
https://i.redd.it/rd1kr881e1921.jpg,2019-01-07 17:33:13,,,A cane toad eating a bat,2021-04-07 08:57:25
https://i.imgur.com/2Ys0LUg.jpg,2019-01-07 17:28:54,,,A cane toad eating a bat,2021-04-07 08:57:25
https://i.redd.it/s0lccyw86j721.jpg,2019-01-01 14:56:36,,,"Cane Toads hitching a ride on a Python, while at the side a toad is 'hitching a ride' on another toad",2021-04-07 08:57:32
https://i.redd.it/ebledq5lkn721.jpg,2018-12-31 18:00:58,,bakakon1,Cane toad hitchhiking a ride. https://apple.news/A6O3u7UgERB-E-v8tRUh--w,2021-04-07 08:57:32
https://i.redd.it/0mk0keevqb421.jpg,2018-12-14 23:02:21,,frogsnplants,I know it’s not a reptile but r/frogs hasn’t given any help. I got my cane toad 2 weeks ago and the past 4 days he’s been sat in his water bowl. I’m worried he may be impacted but he hasn’t eaten since I got him,2021-04-07 08:57:35
https://i.redd.it/wgrco8zrja021.png,2018-11-24 14:44:33,,Emeglebon,The Cane Toad,2021-04-07 08:57:37
https://i.imgur.com/sD3Tn1G.gifv,2018-11-07 14:54:30,,Birdbrainpigeonboy,🔥 Suriname Cane Toad 🔥,2021-04-07 08:57:39
https://i.imgur.com/sD3Tn1G.gifv,2018-11-07 06:08:56,,SquatchCalls,🔥 Suriname Cane Toad 🔥,2021-04-07 08:57:39
https://i.imgur.com/sD3Tn1G.gifv,2018-11-07 05:39:14,,Tao_Dragon,"Suriname Cane Toad - a brutal, metal & lit frog 🔥 (xpost from /r/NatureIsFuckingLit)",2021-04-07 08:57:40
https://i.imgur.com/sD3Tn1G.gifv,2018-11-07 01:13:53,,aqai,🔥 Suriname Cane Toad 🔥,2021-04-07 08:57:40
https://i.redd.it/ty6e774tpjt11.jpg,2018-10-21 14:05:07,,cormag2464,"Roses are red, I really love my Cane Toad,",2021-04-07 08:57:44
https://i.redd.it/5mw8h0wqvco11.jpg,2018-09-25 09:45:18,,UncleTrundlethegreat,"Hey guys, can anybody ID this horrendous looking thing? Pretty sure it’s a cane toad but I’m in northern NSW so I’m confused",2021-04-07 08:57:46
https://www.eurekalert.org/pub_releases/2018-09/uons-scg091218.php,2018-09-20 13:28:06,,billfredgilford,"Scientists have cracked the genetic code of the cane toad, allowing more research to be sequenced at a fraction of the cost.",2021-04-07 08:57:49
https://www.brisbanetimes.com.au/politics/queensland/virus-discovery-offers-new-means-of-controlling-queensland-s-cane-toad-20180919-p504og.html,2018-09-20 00:28:08,,hydralime,Virus discovery offers new means of controlling Queensland's cane toad,2021-04-07 08:57:52
https://i.redd.it/ma8caiqz8xl11.jpg,2018-09-13 03:06:24,,RPBot,[Knife] Busse ASH2 with Cane Toad inlay sheath,2021-04-07 08:57:54
https://i.redd.it/ma8caiqz8xl11.jpg,2018-09-13 03:06:16,,RPBot,Busse ASH2 with Cane Toad inlay sheath,2021-04-07 08:57:54
https://i.redd.it/ma8caiqz8xl11.jpg,2018-09-13 03:03:11,,,Busse ASH2 with Cane Toad inlay sheath,2021-04-07 08:57:55
https://i.imgur.com/FUaH2qB.jpg,2018-08-30 01:15:17,,,Invasive Cane Toad,2021-04-07 08:57:58
https://i.redd.it/q395geq5pgd11.jpg,2018-08-01 10:50:14,,ArtLaudy,Is this a cane toad?,2021-04-07 08:57:59
https://i.imgur.com/E50ZqeY.jpg,2018-07-19 13:36:26,,ILikeSexyHumans,"Seriously, you cane-toad-licking fucks are getting annoying",2021-04-07 08:58:00
https://i.redd.it/iyqtvmmcir911.png,2018-07-13 18:55:52,,,Monstrous Corruption by Cane Toad,2021-04-07 08:58:02
https://i.redd.it/9lzwleqvvx811.jpg,2018-07-09 15:17:32,,yorelcm,Cane Toad Licks Own Back,2021-04-07 08:58:02
https://i.imgur.com/6Q9Usjs.png,2018-06-30 15:11:47,,Rory_Breakers_milk,Can anyone help me identify this handsome gentleman from South Florida (I'm thinking it's a Cane/Bufo Toad),2021-04-07 08:58:04
https://i.redd.it/6v569ww82h611.jpg,2018-06-27 04:34:29,,Dorien_Green,On a post about cane toad sausages...,2021-04-07 08:58:04
https://phys.org/news/2018-06-toxic-toad-invasion-madagascar-predators.html,2018-06-07 00:13:51,,FillsYourNiche,Genetic evidence confirms cane toad invasion puts Madagascar's predators at risk due to high sensitivity to toad toxins.,2021-04-07 08:58:15
https://preview.redd.it/etzc3jlz1d011.jpg?width=4288&format=pjpg&auto=webp&s=f3fb29f7832cff2351d021275f751cd4badf85d2,2018-05-27 08:41:45,"[3216, 4288]",pineapplecynical,meet this cane toad,2021-04-07 08:58:17
https://i.redd.it/pmusw1dfzhz01.jpg,2018-05-23 00:11:30,,,"Edna, the 3 year old cane toad detection dog. She helps prevent the spread of cane toads which destroy Australian flora and fauna.",2021-04-07 08:58:17
https://i.redd.it/oq7vg4hx8cy01.jpg,2018-05-17 03:49:54,,reallyhighelf,Cane toad eggs,2021-04-07 08:58:18
https://i.redd.it/ocu4x47dj4w01.jpg,2018-05-05 23:48:43,,L1ttl3J1m,"Is this a cane toad? Because if it is, Wivenhoe is fucked",2021-04-07 08:58:19
https://www.smh.com.au/environment/sustainability/plan-to-kill-carp-with-herpes-could-prove-as-foolish-as-cane-toad-20180503-p4zd4m.html,2018-05-04 02:43:58,,straylittlelambs,Plan to kill carp with herpes could prove as foolish as cane toad,2021-04-07 08:58:21
https://i.redd.it/2w1ko57kbrt01.jpg,2018-04-24 01:10:44,,OverlordSheepie,Cane toad friends,2021-04-07 08:58:22
https://i.redd.it/r8de1aa669q01.jpg,2018-04-06 09:03:30,,,How To EAT: eagle eating a rat and raise you a cane toad eating a ba,2021-04-07 08:58:24
https://i.redd.it/pxyl9hx37hn01.jpg,2018-03-23 08:43:08,,Tiger_Pop,I see your cane toad eating a bat and raise you a plant eating a rat,2021-04-07 08:58:27
https://i.redd.it/ckj2t3yylgn01.jpg,2018-03-23 06:44:40,,,I see your cane toad eating bat and rinse you an African Crowned Eagle eating a Monkey.,2021-04-07 08:58:28
https://i.redd.it/ow41q80v2gn01.jpg,2018-03-23 04:57:32,,,I see your cane toad eating a bat and raise you a heron eating a muskrat,2021-04-07 08:58:28
https://i.redd.it/nzn91wv9dfn01.jpg,2018-03-23 02:34:09,,,I see your wedge tailed eagle eating a rat and your cane toad eating a bat and raise you a hippo devouring a crocodile...,2021-04-07 08:58:28
https://i.redd.it/uj3sh79f8en01.jpg,2018-03-22 22:45:09,,js057,I see your cane toad and raise you a Pixie frog eating a mouse.,2021-04-07 08:58:30
https://i.redd.it/un1oa32l5en01.png,2018-03-22 22:29:13,,ConsterMock93,PsBattle: Cane Toad Eating a Bat,2021-04-07 08:58:30
https://i.redd.it/5zy2eq1kmdn01.jpg,2018-03-22 20:42:35,,,I see your cane toad eating a bat and raise you a bird eating a seal's brain through its eye,2021-04-07 08:58:32
https://i.redd.it/qumquzm11dn01.jpg,2018-03-22 18:42:00,,,I see your cane toad eating a bat and raise you a leopard seal ripping a penguin's head off.,2021-04-07 08:58:32
https://i.redd.it/e9fr34ea0dn01.jpg,2018-03-22 18:37:48,,,I see your cane toad eating a bat and raide you a leopard seal ripping a penguin's head off.,2021-04-07 08:58:33
https://i.redd.it/ks35g2k00dn01.jpg,2018-03-22 18:36:15,,,I see your cane toad eating a bat and I raise a gecko wielding a board pin,2021-04-07 08:58:33
https://i.redd.it/nrb8dhxorcn01.jpg,2018-03-22 17:50:29,,Plebaloon,I see your cane toad eating a bat and raise you a sea gull eating a blackbird,2021-04-07 08:58:33
https://i.redd.it/52lvtf9lqcn01.jpg,2018-03-22 17:47:59,,,I see your Cane Toad eating a bat and raise you a Hawk eating a squirrel.,2021-04-07 08:58:34
https://i.redd.it/h7ubmjiwmcn01.jpg,2018-03-22 17:22:44,,OGPanBlanco,I see your cane toad eating a bat and I raise you a Great tit eating another bird’s brain through its throat.,2021-04-07 08:58:34
https://africageographic.com/wp-content/uploads/2015/07/lion-head-hyena.jpg,2018-03-22 15:56:55,,,I see your cane toad eating a bat and raise you a hyena eating a cat,2021-04-07 08:58:35
https://i.redd.it/i30jb2pc3cn01.jpg,2018-03-22 15:33:09,,,I see your cane toad eating a bat and raise you a crocodile eating a goose,2021-04-07 08:58:35
https://i.redd.it/d332ahafkbn01.jpg,2018-03-22 13:47:46,,,I see your cane toad eating a bat and raise you a Smeagol eating a fish,2021-04-07 08:58:35
https://i.imgur.com/Z0hmYM3.jpg,2018-03-22 12:45:49,,,🔥 Peruvian cane toad eating a bat,2021-04-07 08:58:36
https://i.imgur.com/BHBQMp6.jpg,2018-03-22 12:39:51,,mattjh,I see your wedge-tailed eagle eating a rat and raise you a cane toad eating a bat,2021-04-07 08:58:36
http://www.nationalgeographic.com.au/australia/is-the-australian-crow-smarter-than-other-bird-species.aspx,2018-02-19 08:34:13,,AndyLC,Crow that learned how to avoid the poisonous parts of the cane toad (invasive species) is big brain 🔥🔥🔥,2021-04-07 08:58:44
https://i.imgur.com/ovYc0Hq.jpg,2018-02-19 00:06:43,,,"I see your cane toad and raise you a cane rat...moral of the story, stay the fuck out of the cane!",2021-04-07 08:58:45
https://i.redd.it/9x9c7hdjjdg01.jpg,2018-02-15 12:56:58,,,the perfect gift for your missus! a cane toad purse,2021-04-07 08:58:46
https://www.youtube.com/watch?v=p-ut7-cjwXw&feature=youtu.be,2018-01-31 11:59:10,,dazblazem,Axel Found a Poisonous Cane Toad,2021-04-07 08:58:48
https://i.imgur.com/GnS1fSm.png,2018-01-28 23:01:47,,AJgloe,Progression of the Cane Toad Population 1940-1980,2021-04-07 08:58:48
