image url,date taken,image size,account,description,date accessed
https://preview.redd.it/4q9syswxglr61.png?width=1600&format=png&auto=webp&s=d980e37dc49c176e10804f4049199b22bed2dfb0,2021-04-06 18:13:02,"[1600, 1600]",BLT_WITH_RANCH,[Whisper Child] - Part 25,2021-04-07 08:53:19
https://i.redd.it/oodiottjeeq61.jpg,2021-03-31 17:24:52,,joebidensuncle,"Looking to get a cane toad, could someone describe me the specifics and what I would need for having one as a pet?",2021-04-07 08:53:21
https://upload.wikimedia.org/wikipedia/commons/thumb/0/0e/Cane_toad_-_ABC_News.jpg/800px-Cane_toad_-_ABC_News.jpg,2021-03-28 03:31:14,,polish_delight,cane toad,2021-04-07 08:53:22
https://i.redd.it/j5jrs20yy8n61.jpg,2021-03-15 19:56:18,,ShadowStar0110,Cane toad (Hawaii),2021-04-07 08:53:23
https://i.redd.it/y48mqq5igym61.jpg,2021-03-14 08:35:01,,lil_cheezicle,My cane toad has that throat bubble and I think he's trying to call. I've recently heard him chirping a lot when he's just in his hide. Has anyone had their toads call?,2021-04-07 08:53:24
https://i.redd.it/ewz46e0y3ul61.jpg,2021-03-08 16:53:16,,dalburgh,"My Cane Toad, Toadette.",2021-04-07 08:53:26
https://i.redd.it/ha1u5f7b7xk61.jpg,2021-03-04 02:13:20,,c46676,Is this a cane toad? Found in Naples Florida,2021-04-07 08:53:27
https://i.redd.it/61vwvl98usk61.jpg,2021-03-03 11:32:54,,Edikici,"A Pair of Cane Toads (Rhinella marina formerly Bufo marinus) AKA marine toad in amplexus at Fairchild Gardens Shot with Nikon D500 Nikkor 300 mm f/4 PF + TC-14E III lens, shot at 1/1250 s, f/5.6 ISO 280",2021-04-07 08:53:27
https://i.redd.it/dkohar8kjaj61.jpg,2021-02-23 20:56:54,,skynicks,"Cane or Southern toad? Juvenile- around 1-2cm, found herping in South Florida",2021-04-07 08:53:29
https://i.redd.it/7kbasxa74wi61.png,2021-02-21 20:25:54,,0steopod,(bullfrog) cane toad (40c),2021-04-07 08:53:30
https://i.redd.it/uksdgd5wgji61.jpg,2021-02-20 01:54:45,,demisexgod,cane toad unit in my dog food,2021-04-07 08:53:32
https://i.redd.it/tzmi18nb8nh61.jpg,2021-02-15 13:29:14,,codeword_towedtoad,"Is this a cane toad? Advice on what to do when toxin gets on you, esp with kids?",2021-04-07 08:53:33
https://i.redd.it/ejrpxhruo1h61.jpg,2021-02-12 13:02:15,,,"Hi, I know nothing about froggys and toads but I found this lil guy in a drain at my property I know the photos pretty poor but just wondering if anyone could maybe identify what type it is? (I live in southern NSW, Australia. Tbh just confirming it’s not a baby cane toad or anything) Thanks!",2021-04-07 08:53:35
https://preview.redd.it/ftz7i1rd1fe61.png?width=587&format=png&auto=webp&s=140c31a54c162a4b6e149392feadcae4d5f0ce1f,2021-01-30 06:42:09,"[490, 587]",Pretty_iin_Pink,Coronavirus Downunder Nightly ɯopuɐɹ Discussion - 30 January 2021,2021-04-07 08:53:37
https://preview.redd.it/w4isb9dfx0e61.png?width=300&format=png&auto=webp&s=6b0d56f0498dbfad1ecd93ceeadeafe292b3723c,2021-01-29 06:30:15,"[300, 300]",Pretty_iin_Pink,Coronavirus Downunder Nightly ɯopuɐɹ Discussion - 29 January 2021,2021-04-07 08:53:37
https://i.redd.it/0gmtbsc0g6e61.jpg,2021-01-29 01:49:11,,LilLarz,"First time poster! This cane toad was created with arteza inkonics pens and is my most popular piece right now, though I find the linework much too sloppy",2021-04-07 08:53:38
https://i.redd.it/4947pkrktzd61.jpg,2021-01-28 03:32:46,,katana11,Carpet python VS cane toad - no winners,2021-04-07 08:53:38
https://i.redd.it/q2ri8fmh7yc61.jpg,2021-01-22 21:03:07,,DocHolliday637,Cane Toad that I photographed at a friends.,2021-04-07 08:53:39
https://i.redd.it/lu6n3oaw3cc61.jpg,2021-01-19 18:45:20,,ThatPhotoGuy2019,Please tell me I didn't just photograph a Curlew killing her child accidentally? I'm so hoping that's not a cane toad!,2021-04-07 08:53:41
https://i.redd.it/xni2uz299nb61.jpg,2021-01-16 07:09:21,,Educational-Trash252,"My Cane Toad, Krumm",2021-04-07 08:53:42
https://i.redd.it/dqymdfp4yta61.jpg,2021-01-12 04:35:11,,lil_cheezicle,My cane toad be drippin. He pooped in his clean water bowl after this,2021-04-07 08:53:44
https://i.redd.it/c33soch825a61.jpg,2021-01-08 16:53:39,,Dhorlin,A superb burrowing owl preparing to attack a cane toad in an urban courtyard in Rio de Janeiro.,2021-04-07 08:53:44
https://i.redd.it/u31udvk8zf961.jpg,2021-01-05 04:32:41,,slothofmoss,Australian cane toad leather purses,2021-04-07 08:53:45
https://i.redd.it/67rz7kxsfu861.jpg,2021-01-02 04:06:18,,lil_cheezicle,"If you guys need a new tank for your toads, petco is doing the dollar per gallon sale right now. I just picked up this 20 long for my cane toad.",2021-04-07 08:53:45
https://i.redd.it/ppi9qieb05861.jpg,2020-12-29 14:34:40,,tgood139,An Australian Freshwater Crocodile eating an invasive (and highly poisonous) Cane Toad,2021-04-07 08:53:46
https://i.redd.it/xpzak6o1ip761.jpg,2020-12-27 10:25:33,,Hemutia,Cane Toad? Any advice or info?,2021-04-07 08:53:48
https://i.redd.it/komdz343uz661.jpg,2020-12-23 20:06:41,,ashleybri-,"Empathy of a toddler, IQ of a cane toad",2021-04-07 08:53:48
https://i.redd.it/x0l3i9gt5o661.jpg,2020-12-22 04:51:03,,lil_cheezicle,How can I tame my cane toad?,2021-04-07 08:53:50
https://i.redd.it/7grc7kbgaz461.png,2020-12-13 16:09:04,,Myhailot,[Goliath Bullfrog] Cane Toad (60c),2021-04-07 08:53:51
https://i.redd.it/by3aqpyd0y361.png,2020-12-08 10:46:04,,,Invest cane toad.,2021-04-07 08:53:52
https://i.redd.it/nx2f4cwmzx361.png,2020-12-08 10:42:59,,,Sad cane toad. Could be a good meme template,2021-04-07 08:53:53
https://i.redd.it/r1cu8xjkhf361.jpg,2020-12-05 20:28:47,,,Is this a bay cane toad?,2021-04-07 08:53:53
https://i.redd.it/2yb7h9qcu3361.jpg,2020-12-04 05:23:07,,lil_cheezicle,I fed my cane toad some mealworms and he pooped their exoskeletons out. Is that normal? What i think happened is that he pooped in the water and he was splashing and the poop broke up and thaths why there's a bunch of little worm pieces.,2021-04-07 08:53:55
https://preview.redd.it/kutkrr3y7g261.jpg?width=3024&format=pjpg&auto=webp&s=0bd34cc2b222821e4158f9837e500c8d2bcf60ab,2020-11-30 21:52:13,"[4032, 3024]",mdw1424,Is this a cane toad? I have two dogs and just saw three of these in my yard. Please help!!!,2021-04-07 08:53:56
https://preview.redd.it/mj498s3y7g261.jpg?width=3024&format=pjpg&auto=webp&s=47c0b5486358c8cfcab8f88e83e9b5e18cc4ed54,2020-11-30 21:52:13,"[4032, 3024]",mdw1424,Is this a cane toad? I have two dogs and just saw three of these in my yard. Please help!!!,2021-04-07 08:53:56
https://preview.redd.it/oma0us3y7g261.jpg?width=3024&format=pjpg&auto=webp&s=e5bcefe5be86b393b4003443da4561f7769dbc99,2020-11-30 21:52:13,"[4032, 3024]",mdw1424,Is this a cane toad? I have two dogs and just saw three of these in my yard. Please help!!!,2021-04-07 08:53:56
https://i.redd.it/fmbdko8f19161.jpg,2020-11-24 20:39:05,,eunice_may,"I’m from Australia and I’ve got a little guy in my bird bath, just wanted to know if it’s a cane toad or not? Have trouble identifying thank you !!!",2021-04-07 08:54:01
https://i.redd.it/25ifke869r061.jpg,2020-11-22 08:50:27,,seanercorn,Australia cane toad taxidermy by Kevin Ladynski,2021-04-07 08:54:03
https://i.redd.it/w1qtougdc2061.jpg,2020-11-18 21:04:02,,SILENCExSIMP,Snake dies after trying to eat a Cane Toad,2021-04-07 08:54:04
https://i.redd.it/ef02yvwfb2z51.jpg,2020-11-13 19:54:26,,Bappo-nope,This is Gregory he’s a cane toad in Australia he’s a little fucker but he’s home so he happy,2021-04-07 08:54:08
https://i.redd.it/3n8l7om2xuy51.jpg,2020-11-12 19:01:26,,panarthropodism,A rather unamused juvenile cane toad (Rhinella marina) from Brown Lake in Minjerribah [oc],2021-04-07 08:54:09
https://i.redd.it/qeqm8hprzay51.jpg,2020-11-10 00:01:30,,,"Cat Eye Snake (sometimes known as a false Fer-de-lance) eating a baby Cane Toad. Most animals aren't able to survive eating a cane toad whole due to this toad's ability to produce a bufotoxin when threatened, but this snake can. Photographed in Costa Rica by me.",2021-04-07 08:54:10
https://i.redd.it/6ovhna05t2y51.jpg,2020-11-08 20:45:34,,,"Cat Eye Snake (sometimes known as a false Fer-de-lance) eating a baby Cane Toad. Most animals aren't able to survive eating a cane toad whole due to this toad's ability to produce a bufotoxin when threatened, but this snake can. Photographed in Costa Rica by me.",2021-04-07 08:54:10
https://i.redd.it/ovijc4jiwqv51.jpg,2020-10-28 02:18:55,,,Cane toad. Mouth of the Amazon.,2021-04-07 08:54:12
https://i.redd.it/42eqx1crpqv51.jpg,2020-10-28 01:41:00,,,🔥Cane Toad the beast of eating everything.,2021-04-07 08:54:12
https://i.redd.it/1zjzf6l8oqv51.jpg,2020-10-28 01:32:27,,,Drew a Cane Toad. These guys are crazy!,2021-04-07 08:54:13
https://i.redd.it/j97rlz23iqv51.jpg,2020-10-28 00:58:08,,,"Cane toad, Me (Lindsey Munson), Mixed Media, 2020",2021-04-07 08:54:13
https://preview.redd.it/t71721hwtov51.png?width=812&format=png&auto=webp&s=213292a926a3e23ff9890c74cb759f022d47f9d5,2020-10-27 19:24:25,"[553, 812]",Kazukiii,Thrive Reptile Moss Corner Hide,2021-04-07 08:54:14
https://i.redd.it/5u38l43mrfu51.jpg,2020-10-21 11:47:35,,Throwawaytwinkydinky,My pet Cane Toad named Dusty.,2021-04-07 08:54:15
https://i.redd.it/14djmv7g5cu51.jpg,2020-10-20 23:38:00,,dootdoot1997,Turns out that cane toad lives there,2021-04-07 08:54:15
https://preview.redd.it/kq3rttgyens51.jpg?width=3024&format=pjpg&auto=webp&s=6389a862082314c58ef7e32b6d1b74085f6f6bbe,2020-10-12 11:22:38,"[4032, 3024]",bingebabe,Can anyone ID this ? Not sure if baby cane toad or similar looking native. Hunter Valley NSW Aus,2021-04-07 08:54:17
https://preview.redd.it/6dy10tgyens51.jpg?width=3024&format=pjpg&auto=webp&s=c741c10651a31536f3dd829b2a7a603246e6ac17,2020-10-12 11:22:38,"[4032, 3024]",bingebabe,Can anyone ID this ? Not sure if baby cane toad or similar looking native. Hunter Valley NSW Aus,2021-04-07 08:54:17
https://i.redd.it/1twxvurfror51.jpg,2020-10-07 14:50:15,,louatl1015,Anyone know if this is a Cane toad?? It sit in and around my cat food,2021-04-07 08:54:18
https://preview.redd.it/nnk5tctz2lr51.jpg?width=375&format=pjpg&auto=webp&s=72c784c86f8f06efe88714fc6bf4f4d103abc5a3,2020-10-07 02:27:51,"[500, 375]",brandodano,Is this a cane toad?,2021-04-07 08:54:19
https://preview.redd.it/kjcw7ctz2lr51.jpg?width=375&format=pjpg&auto=webp&s=881ada20de87ff51eb1c2e77ce03dfac03d0e74a,2020-10-07 02:27:51,"[500, 375]",brandodano,Is this a cane toad?,2021-04-07 08:54:19
https://preview.redd.it/0v6ubbtz2lr51.jpg?width=375&format=pjpg&auto=webp&s=9611b7df7dd68fd69e018180b42664ceb2c73b70,2020-10-07 02:27:51,"[500, 375]",brandodano,Is this a cane toad?,2021-04-07 08:54:19
https://preview.redd.it/tw13ndtz2lr51.jpg?width=750&format=pjpg&auto=webp&s=868d5261a51a4f4f938931cc1e74c58a67735ec8,2020-10-07 02:27:51,"[1624, 750]",brandodano,Is this a cane toad?,2021-04-07 08:54:19
https://preview.redd.it/a6m49ctz2lr51.jpg?width=750&format=pjpg&auto=webp&s=07b6ac36a9cbb604791829352b6f1f798985dab5,2020-10-07 02:27:51,"[1624, 750]",brandodano,Is this a cane toad?,2021-04-07 08:54:19
https://i.redd.it/nc84ntkydbr51.png,2020-10-05 17:55:30,,falconsnakecat786,"Cane Toads have poison glands that kill predators who eat them but in Australia, where this species is invasive, certain crows have learned to kill the toads in ways where they don't touch it's poison glands and then eat the toad while still avoiding the poison glands.",2021-04-07 08:54:19
https://preview.redd.it/h5279f82qar51.jpg?width=4032&format=pjpg&auto=webp&s=7d9b21989a9517ce6431910ac69968712fd5b41c,2020-10-05 15:37:36,"[3024, 4032]",Mayayay99,"Help identifying this little guy in NSW Australia, please! Cane toad or not?",2021-04-07 08:54:19
https://preview.redd.it/m7kjrh82qar51.jpg?width=4032&format=pjpg&auto=webp&s=52ba8553c37544a75776769dd6bf32eaac9e48ef,2020-10-05 15:37:36,"[3024, 4032]",Mayayay99,"Help identifying this little guy in NSW Australia, please! Cane toad or not?",2021-04-07 08:54:19
https://i.redd.it/dl2rm7beimq51.png,2020-10-02 06:12:53,,Adarie-Glitterwings,"OC october day 2: playing a sport. In this case, toad-golf. Don't worry, it's a cane toad, so it's fine. In fact, it's encouraged. (In QLD - illegal not to kill them)",2021-04-07 08:54:21
https://i.redd.it/i3w86dm0cfq51.jpg,2020-10-01 06:03:37,,Dakine_Gfunk,Chonky Cane Toad (Size 13 Slipper for Ref),2021-04-07 08:54:22
https://i.redd.it/ou26za3k1do51.jpg,2020-09-20 20:13:12,,PierreEstagos,Large Cane Toad (Rhinella marina) spotted in Western Florida,2021-04-07 08:54:22
https://i.redd.it/desv9dcsxfn51.jpg,2020-09-16 04:53:15,,,Cane toad trying his best.,2021-04-07 08:54:24
https://i.redd.it/00cldokfxam51.jpg,2020-09-10 10:58:13,,lordofthedoorhandles,Is this a cane toad? Eastern NSW,2021-04-07 08:54:25
https://preview.redd.it/f5xe1dz188m51.jpg?width=4608&format=pjpg&auto=webp&s=108088437d5eaaca58ecb0083cee2f720eee6251,2020-09-10 01:52:24,"[3456, 4608]",ScuzzyUltrawide,WTS one slightly used poisonous cane toad,2021-04-07 08:54:26
https://preview.redd.it/p3vwp1u188m51.jpg?width=3456&format=pjpg&auto=webp&s=599a40fccba5d032f89753461ef94f99443421ce,2020-09-10 01:52:24,"[4608, 3456]",ScuzzyUltrawide,WTS one slightly used poisonous cane toad,2021-04-07 08:54:26
https://i.redd.it/7qwhukgsfvl51.png,2020-09-08 06:53:36,,SirWernich,Real Sugar Cane Toad full-body purse,2021-04-07 08:54:26
https://i.redd.it/0k6iyrrkufl51.jpg,2020-09-06 02:26:58,,roguez2019,Would this be okay for my cane toad in his water?,2021-04-07 08:54:28
https://i.redd.it/shcfjhoc8al51.jpg,2020-09-05 07:33:31,,,Do I need to say anything more but CANE TOAD BE VIBIN',2021-04-07 08:54:29
https://i.redd.it/8l89550cioi51.jpg,2020-08-23 04:22:01,,,Can anyone help with the ID? Between Southern and Cane Toad here in Ft Lauderdale but doesn’t have shield or crests. Super mottled belly,2021-04-07 08:54:33
https://i.redd.it/26lcwg3cggi51.jpg,2020-08-22 01:16:34,,paxtonRojas,Pet cane toad pancake,2021-04-07 08:54:34
https://i.redd.it/36mp0x630ci51.jpg,2020-08-21 10:18:23,,,Cane toad. Naturally contains 5-Meo-DMT in its poison.,2021-04-07 08:54:34
https://preview.redd.it/d5irsdl5alg51.jpg?width=1920&format=pjpg&auto=webp&s=568c685b21c944bae78c28dfb5c17be7c5c1ca56,2020-08-12 15:22:54,"[2560, 1920]",AWildRaticate,"Help with ID? Found outside my apartment in Shenzhen, China. Looks like a toad, but is smooth and slick like a frog. I picked it up thinking it was a cane toad, which are everywhere at my place, but it's very much not.",2021-04-07 08:54:40
https://preview.redd.it/6khqz4d7alg51.jpg?width=1920&format=pjpg&auto=webp&s=3a52d8867022da1ef412bdcf2e9346b9e784ea0c,2020-08-12 15:22:54,"[2560, 1920]",AWildRaticate,"Help with ID? Found outside my apartment in Shenzhen, China. Looks like a toad, but is smooth and slick like a frog. I picked it up thinking it was a cane toad, which are everywhere at my place, but it's very much not.",2021-04-07 08:54:40
https://i.redd.it/szfdmjvx4dg51.jpg,2020-08-11 12:00:17,,tekisutomusic,Saw this Hawaiian Cane toad just vibing outside,2021-04-07 08:54:40
https://i.redd.it/k5v0p96o4dg51.jpg,2020-08-11 11:57:45,,tekisutomusic,ITAP of a Hawaiian Cane toad,2021-04-07 08:54:40
https://preview.redd.it/ej8y8xe8bpe51.jpg?width=4032&format=pjpg&auto=webp&s=71dc90b0b1c3227b42e60e027eb1c6f9b47ccfa5,2020-08-03 02:47:29,"[3024, 4032]",roguez2019,"My female cane toad, doing better. No parasites yay! She’s been gaining slowly. Still have to force feed she doesn’t hunt any bugs have tried everything",2021-04-07 08:54:43
https://preview.redd.it/488uixe8bpe51.jpg?width=4032&format=pjpg&auto=webp&s=b21f30c4b3a1d98131f3c7c6cbf4b895c5ca18c2,2020-08-03 02:47:29,"[3024, 4032]",roguez2019,"My female cane toad, doing better. No parasites yay! She’s been gaining slowly. Still have to force feed she doesn’t hunt any bugs have tried everything",2021-04-07 08:54:43
https://i.redd.it/c698yzmpird51.jpg,2020-07-29 09:09:13,,TheJoshMosh,Ya'll remember slippy? Anyway I found this baby Cane toad and ngl he's actually really cute 😁,2021-04-07 08:54:44
https://i.redd.it/g1f28e2mzpc51.jpg,2020-07-24 02:55:51,,skybrothers,This cane toad looks like it has bbq sauce on his lips,2021-04-07 08:54:46
https://i.redd.it/cqw1l9cdz2c51.jpg,2020-07-20 21:33:28,,,This Cane Toad,2021-04-07 08:54:47
https://i.redd.it/2m6vrej3qob51.jpg,2020-07-18 21:36:33,,skybrothers,Fat cane toad says hi,2021-04-07 08:54:48
https://i.redd.it/7m9u50xtvab51.jpg,2020-07-16 23:04:32,,HonziPonzi,Anybody know if this is a cane toad?,2021-04-07 08:54:48
https://i.redd.it/nqm744yhuab51.jpg,2020-07-16 22:57:19,,HonziPonzi,This isn't a cane toad is it? [North Florida],2021-04-07 08:54:49
https://i.redd.it/lv7qa22np8b51.jpg,2020-07-16 15:45:31,,,I found a cane toad I got ran over by a car on the road,2021-04-07 08:54:49
https://i.redd.it/qu6p4vicbsa51.jpg,2020-07-14 08:37:23,,,"[Georgia, US] Is this A Cane Toad or Just a regular toad or frog?",2021-04-07 08:54:50
https://i.redd.it/ncphws2rbra51.jpg,2020-07-14 05:17:22,,skybrothers,Caught a tiny cane toad,2021-04-07 08:54:51
https://i.redd.it/fwnmntm1sqa51.jpg,2020-07-14 03:27:05,,,Could anybody tell me if this is a Cane Toad?,2021-04-07 08:54:51
https://i.redd.it/of17pgnqrqa51.jpg,2020-07-14 03:25:19,,,Could anybody tell me if this is a Cane Toad?,2021-04-07 08:54:51
https://i.redd.it/kb2rvwserp931.jpg,2020-07-11 08:27:08,,dirtyviking1337,Slightly larger than normal cane toad.,2021-04-07 08:54:52
https://i.redd.it/kb2rvwserp931.jpg,2020-07-11 05:56:34,,Defiant-Month,Slightly larger than normal cane toad.,2021-04-07 08:54:52
https://i.redd.it/kb2rvwserp931.jpg,2020-07-11 04:28:29,,RoscoMan1,Slightly larger than normal cane toad.,2021-04-07 08:54:53
https://i.redd.it/kb2rvwserp931.jpg,2020-07-11 04:15:49,,XhunterboiX,Slightly larger than normal cane toad.,2021-04-07 08:54:53
https://i.redd.it/kb2rvwserp931.jpg,2020-07-11 00:59:46,,howtochangemywife,Slightly larger than normal cane toad.,2021-04-07 08:54:53
https://i.redd.it/ts9tlczukd951.jpg,2020-07-07 05:59:22,,NotEzrasWife,Chasing small girls with a half dead Cane Toad...,2021-04-07 08:54:54
https://i.redd.it/ti93gr4l5e851.jpg,2020-07-02 06:51:26,,,ITAP of a cane toad,2021-04-07 08:54:55
https://i.redd.it/f6opldim1c851.jpg,2020-07-01 23:45:38,,HamAndCheems,Frog or baby cane toad?,2021-04-07 08:54:56
https://i.redd.it/v7kztaa50b651.jpg,2020-06-21 18:07:17,,,Baby Toad-Probably a baby Cane Toad,2021-04-07 08:54:59
https://i.redd.it/41kdw46ve4651.jpg,2020-06-20 19:57:18,,_meuovo,"Check the massive size of this toad found in Brazil. They are a commen toad species, found almost everywhere in Brazil, named ""sapo-cururu"" or ""cane toads"". They can reach up to 40 cm/15 inches in length (legs not included) and weight as much as 3 kg (6.6 lb).",2021-04-07 08:54:59
https://i.redd.it/l2blgopqzy551.png,2020-06-20 01:43:54,,HypaHNovanix,This cane toad came for a visit,2021-04-07 08:55:00
https://i.redd.it/e6ac0larbx351.jpg,2020-06-09 17:59:10,,I_am_strange_,"I found this guy in my grandmother’s house in Bayamón, Puerto Rico. It’s no bigger than the palm of my hand. I assume it’s a Cuban Tree Frog or Red Snouted Tree frog since it doesn’t look like a cane toad and it’s too big to be a coqui.",2021-04-07 08:55:03
https://i.redd.it/p9oel11pis351.jpg,2020-06-09 01:49:21,,,Cane toad? In south FL,2021-04-07 08:55:03
https://i.redd.it/ca4y278nis351.jpg,2020-06-09 01:48:50,,,The Cane Toad,2021-04-07 08:55:03
https://i.redd.it/t4eu521udl351.jpg,2020-06-08 01:49:31,,mustang55,"Do I have a Cane or Southern toad on my hands here? think its one of the poisonous Cane toads, from looking at online images, was hoping maybe someone with more knowledge could confirm. TIA!",2021-04-07 08:55:04
https://i.redd.it/vorz037y9j351.jpg,2020-06-07 18:44:04,,gator426428,Cane Toad,2021-04-07 08:55:05
https://i.redd.it/4kodc7j3gf351.jpg,2020-06-07 05:51:28,,,"Most people don’t know this, but slippy the toad is a cane toad. (Read comments to know the rest I couldn’t fit the whole thing in the title)",2021-04-07 08:55:05
https://i.redd.it/axmgz3kh97351.jpg,2020-06-06 02:20:07,,,Does anyone know what type of toad this is? I am hoping it’s not a cane toad,2021-04-07 08:55:06
https://i.redd.it/kpt8x2s697351.jpg,2020-06-06 02:18:27,,,Does anyone know if this is a cane toad,2021-04-07 08:55:06
https://preview.redd.it/r5jqv6lma0351.jpg?width=1280&format=pjpg&auto=webp&s=1d4c9441c95564de4436a10e6912e02ec6d6c3c9,2020-06-05 02:54:33,"[960, 1280]",pinner,Toad Identification - Is this a cane toad?,2021-04-07 08:55:07
https://preview.redd.it/2dnvy7lma0351.jpg?width=1280&format=pjpg&auto=webp&s=1d5f050b95d24ac015af854132b8b42fe1930ad2,2020-06-05 02:54:33,"[960, 1280]",pinner,Toad Identification - Is this a cane toad?,2021-04-07 08:55:07
https://preview.redd.it/yuo8u3lma0351.jpg?width=1280&format=pjpg&auto=webp&s=65dbf27237493c9bf5ba4a88f6c666095f715a04,2020-06-05 02:54:33,"[960, 1280]",pinner,Toad Identification - Is this a cane toad?,2021-04-07 08:55:07
https://i.redd.it/20rgnwumnr251.jpg,2020-06-03 21:50:56,,paytisaway,"this is Bava, my cane toad. she’s a little skinny rn but i’m gonna fatten her up",2021-04-07 08:55:07
https://www.miamiherald.com/news/local/environment/article243206016.html,2020-06-03 13:48:50,,TheRealLooseSeal,"Really helpful video for cane toad identification. These invasive toads have been coming out in droves following this rainy weather, so keep your dogs safe and away from them!",2021-04-07 08:55:07
https://i.redd.it/vlwgmk3wm7151.jpg,2020-05-27 01:26:57,,PeanutBooteir,Cursed_ cane toad corpse purse,2021-04-07 08:55:09
https://i.redd.it/090b3eevp4151.jpg,2020-05-26 15:38:19,,PeanutBooteir,Cursed_ cane toad corpse purse on Etsy,2021-04-07 08:55:10
https://i.redd.it/kmn33wa2p4151.jpg,2020-05-26 15:33:47,,PeanutBooteir,Real cane toad corpse purse,2021-04-07 08:55:10
https://i.redd.it/rj5t6a4vzy051.jpg,2020-05-25 20:23:56,,,Found this dude in my woods today it's a cane toad I think,2021-04-07 08:55:11
https://play.google.com/store/apps/details?id=com.LostNightStudios.YeetDatToad,2020-05-17 09:40:05,,blaze7736,"Yeet dat Toad! Quick game about squishing cane toads, I made [DEV]",2021-04-07 08:55:12
https://i.redd.it/tq3f244whly41.jpg,2020-05-13 20:51:32,,Wowsuchgood14,My Couch’s Spadefoot Toad cane today!!,2021-04-07 08:55:14
https://i.redd.it/qyianq80iby41.jpg,2020-05-12 11:14:21,,chrissyferrer,Cane toad or native? You decide.,2021-04-07 08:55:14
https://i.redd.it/xle352xh2zx41.jpg,2020-05-10 17:26:02,,chrissyferrer,Cane toad or non-invasive natural? Thoughts?,2021-04-07 08:55:14
https://i.redd.it/nor0y9h4piw41.png,2020-05-03 09:18:24,,advicewanted69,Hawaiian cane toad! these bad boys get pretty big!,2021-04-07 08:55:16
https://i.redd.it/6e7qfdw6n5t41.jpg,2020-04-16 10:12:00,,FatSkipperBois,The cane toad,2021-04-07 08:55:25
https://i.redd.it/vv681m9tehs41.jpg,2020-04-13 00:42:24,,Independent-Frog,Nothing like celebrating Easter with a cane toad ☺️,2021-04-07 08:55:26
https://i.redd.it/3p40d1eesdr41.jpg,2020-04-07 11:27:12,,,Could anyone please help identify this fella before I banish him from my mini frog sanctuary? I’m forever getting rid of cane toads (Nth QLD Australia) but he looks more of a native toad.,2021-04-07 08:55:29
https://i.redd.it/q91yz8kua0r41.jpg,2020-04-05 14:05:41,,SuniHostess,"Went to water my cactus, only to find a cane toad",2021-04-07 08:55:30
https://preview.redd.it/2r3cbwauobq41.jpg?width=248&format=pjpg&auto=webp&s=0a0d6c23ba7cceef0b97511d1c09bc5df41fdb23,2020-04-02 02:28:03,"[205, 248]",jhamerfeld,What is this frog/toad?,2021-04-07 08:55:30
https://i.redd.it/j5pghq5nv0q41.png,2020-03-31 14:59:03,,TheAnonymousGojira,Brog-The Cane Toad Pokemon and Narcotoad-The Narcotic Pokemon,2021-04-07 08:55:31
https://i.redd.it/602vwedeffp41.jpg,2020-03-28 14:49:38,,girlysoccerteen,Cane toad in Hawaii! Took this photo sometime last year,2021-04-07 08:55:31
https://i.redd.it/w77p6gb8u6p41.jpg,2020-03-27 09:56:43,,nozinaround,Can anyone tell me what kind of frog/toad this is? Thought it might be a cane toad but I'm not 100% sure,2021-04-07 08:55:33
https://i.redd.it/esewxhypr1p41.jpg,2020-03-26 16:53:45,,Evolving_Dore,Cane Toad Blues,2021-04-07 08:55:33
https://i.redd.it/wmrk994x1jo41.jpg,2020-03-24 01:57:09,,bruizerrrrr,"My Cane Toad, Waffles",2021-04-07 08:55:34
https://i.redd.it/tpuugcxksfo41.jpg,2020-03-23 14:59:23,,LocalSprinklesDealer,"This cane toad (I've named him Clementine) comes to my window every night at around 1am. He runs into it, chills for like 5 minutes and then just leaves. Any ideas as to why?",2021-04-07 08:55:34
https://i.redd.it/432dlpj60um41.jpg,2020-03-15 12:38:37,,,Giant Cane Toad is watching you.,2021-04-07 08:55:35
https://i.redd.it/rjqdrxgikbl41.jpg,2020-03-07 21:34:38,,ItsBulkingSeasonLads,Cane Toad Eggs are Forbidden Pasta,2021-04-07 08:55:35
https://i.redd.it/ifjt23jktgk41.jpg,2020-03-03 14:10:13,,laplantes_knives,Cane toad and coin inlayed mario sheath I'm working on,2021-04-07 08:55:36
https://i.redd.it/8kcphgco2yj41.jpg,2020-02-29 23:07:23,,,"Help needed! Is anyone able to tell me if this is a cane toad or a frog? Australian here, hope this post is okay! Thanks in advance!",2021-04-07 08:55:37
https://preview.redd.it/gctvq7x3aoj41.png?width=1125&format=png&auto=webp&s=65e5a870ce822a5af998dc8954fa542a030c8531,2020-02-28 14:07:55,"[675, 1125]",,"""to feast on their hearts""",2021-04-07 08:55:38
https://i.redd.it/1ytmil0nhkj41.jpg,2020-02-28 01:26:16,,TheAnonymousGojira,Brog-The Cane Toad Pokemon,2021-04-07 08:55:38
https://i.redd.it/o86pxy5rr7h41.jpg,2020-02-16 04:31:34,,AliceThrewtheGlass,These are coin purses made from Cane Toad skins.,2021-04-07 08:55:40
https://preview.redd.it/v0d0w48rbfg41.png?width=673&format=png&auto=webp&s=b618e20390c866cf76a580fccdc12bd6acb453e3,2020-02-12 06:06:19,"[1137, 673]",HaoXLee,[Arknights lore] Abyssal Hunters and Cute little frog - Blue Poison,2021-04-07 08:55:40
